evidence_id,topic,library,claim,metric,value,unit,dataset_or_code,method,source_url,source_type,author_org,pub_date,retrieved_date,notes
EVID-20250807-StandardCompliance-BoostJSON-001,Standard Compliance,Boost.JSON,"Official docs state JSON is standardized in RFC 8259 and Boost.JSON implements this standard.",standard_compliance,implements,RFC 8259,,documentation,https://www.boost.org/doc/libs/master/libs/json/doc/html/index.html,official_docs,Boost,2025-08-07,2025-08-07,"RFC 8259 is the current JSON standard"
EVID-20250807-StandardCompliance-BoostJSON-002,Standard Compliance,Boost.JSON,"Boost.JSON does not allow byte order marks (BOM) in JSON text as per RFC specification.",bom_support,no,,,documentation,https://www.boost.org/doc/libs/master/libs/json/doc/html/index.html,official_docs,Boost,2025-08-07,2025-08-07,"RFC 8259 prohibits BOM in JSON text"
EVID-20250807-StandardCompliance-BoostJSON-003,Standard Compliance,Boost.JSON,"Library provides parse_options to allow non-standard JSON extensions as opt-in features.",extension_support,supports,,parse_options,documentation,https://www.boost.org/doc/libs/master/libs/json/doc/html/index.html,official_docs,Boost,2025-08-07,2025-08-07,"Extensions are opt-in, not default"
EVID-20250807-StandardCompliance-BoostJSON-004,Standard Compliance,Boost.JSON,"Boost.JSON is a C++11 library for parsing and serializing JSON to DOM containers.",implementation_type,dom_parser,,,documentation,https://github.com/boostorg/json,official_docs,Boost,2025-08-07,2025-08-07,"Header-only library with DOM focus"
EVID-20250807-StandardCompliance-BoostJSON-005,Standard Compliance,Boost.JSON,"Library includes comprehensive test suite for validation and compliance testing.",test_coverage,comprehensive,,test_suite,code,https://github.com/boostorg/json,official_docs,Boost,2025-08-07,2025-08-07,"Includes test_suite.hpp for validation"
